{
  "$schema": "../../../schemas/component-meta.schema.json",
  "name": "Select",
  "description": "Dropdown select with trigger, content, and items",
  "variants": {
    "default": { "svg": "default.svg", "tokens": ["color.input", "color.foreground", "color.popover"] }
  },
  "sizes": ["default"],
  "states": ["default", "open", "disabled", "focus-visible"],
  "responsive": false,
  "codeRef": "services/web/src/shared/components/ui/select.tsx",
  "cvaVariants": false
}
